{
  "$schema": "../schemas/component.json",
  "name": "alert-dialog",
  "description": "A modal dialog that interrupts the user with important content and expects a response.",
  "files": [
    "components/alert-dialog/alert-dialog-action.vue",
    "components/alert-dialog/alert-dialog-cancel.vue",
    "components/alert-dialog/alert-dialog-content.vue",
    "components/alert-dialog/alert-dialog-description.vue",
    "components/alert-dialog/alert-dialog-footer.vue",
    "components/alert-dialog/alert-dialog-header.vue",
    "components/alert-dialog/alert-dialog-root.vue",
    "components/alert-dialog/alert-dialog-title.vue",
    "components/alert-dialog/alert-dialog-trigger.vue",
    "components/alert-dialog/index.ts"
  ],
  "componentDeps": [
    "button"
  ]
}
