{
  "$schema": "../schemas/component.json",
  "name": "card",
  "description": "A container for grouping and displaying related content.",
  "files": [
    "components/card/card-body.vue",
    "components/card/card-description.vue",
    "components/card/card-footer.vue",
    "components/card/card-header.vue",
    "components/card/card-root.vue",
    "components/card/card-title.vue",
    "components/card/index.ts"
  ],
  "componentDeps": [ ],
  "packageDeps": { }
}
