{
  "$schema": "../schemas/component.json",
  "name": "progress-bar",
  "description": "A horizontal progress bar component representing progress towards a goal.",
  "files": [
    "components/progress-bar/progress-bar-root.vue",
    "components/progress-bar/progress-bar-indicator.vue",
    "components/progress-bar/index.ts"
  ],
  "componentDeps": [],
  "packageDeps": {}
}
